{
  "assignments": [
    {
      "buyer_surplus": 6240.0,
      "cleared_unit_price": 11.8,
      "lot_id": "L1",
      "opened_bid": {
        "esg_score": 77,
        "lead_time_days": 19,
        "quality_score": 86,
        "unit_price": 11.8
      },
      "quantity": 1200,
      "score": 0.70058,
      "status": "assigned",
      "supplier_id": "S07"
    },
    {
      "buyer_surplus": 5100.0,
      "cleared_unit_price": 23.0,
      "lot_id": "L2",
      "opened_bid": {
        "esg_score": 86,
        "lead_time_days": 14,
        "quality_score": 91,
        "unit_price": 23.0
      },
      "quantity": 850,
      "score": 0.638095,
      "status": "assigned",
      "supplier_id": "S08"
    },
    {
      "buyer_surplus": 4900.0,
      "cleared_unit_price": 36.0,
      "lot_id": "L3",
      "opened_bid": {
        "esg_score": 95,
        "lead_time_days": 16,
        "quality_score": 92,
        "unit_price": 36.0
      },
      "quantity": 700,
      "score": 0.65,
      "status": "assigned",
      "supplier_id": "S03"
    },
    {
      "buyer_surplus": 4085.0,
      "cleared_unit_price": 9.7,
      "lot_id": "L4",
      "opened_bid": {
        "esg_score": 73,
        "lead_time_days": 14,
        "quality_score": 84,
        "unit_price": 9.7
      },
      "quantity": 950,
      "score": 0.783333,
      "status": "assigned",
      "supplier_id": "S07"
    },
    {
      "buyer_surplus": 6900.0,
      "cleared_unit_price": 52.2,
      "lot_id": "L5",
      "opened_bid": {
        "esg_score": 90,
        "lead_time_days": 19,
        "quality_score": 92,
        "unit_price": 52.2
      },
      "quantity": 500,
      "score": 0.786806,
      "status": "assigned",
      "supplier_id": "S08"
    },
    {
      "buyer_surplus": 6270.0,
      "cleared_unit_price": 13.3,
      "lot_id": "L6",
      "opened_bid": {
        "esg_score": 78,
        "lead_time_days": 18,
        "quality_score": 86,
        "unit_price": 13.3
      },
      "quantity": 1100,
      "score": 0.715858,
      "status": "assigned",
      "supplier_id": "S17"
    },
    {
      "buyer_surplus": 5244.0,
      "cleared_unit_price": 27.1,
      "lot_id": "L7",
      "opened_bid": {
        "esg_score": 87,
        "lead_time_days": 14,
        "quality_score": 92,
        "unit_price": 27.1
      },
      "quantity": 760,
      "score": 0.593978,
      "status": "assigned",
      "supplier_id": "S18"
    },
    {
      "buyer_surplus": 4736.0,
      "cleared_unit_price": 40.6,
      "lot_id": "L8",
      "opened_bid": {
        "esg_score": 96,
        "lead_time_days": 15,
        "quality_score": 93,
        "unit_price": 40.6
      },
      "quantity": 640,
      "score": 0.65,
      "status": "assigned",
      "supplier_id": "S13"
    },
    {
      "buyer_surplus": 2430.0,
      "cleared_unit_price": 9.1,
      "lot_id": "L9",
      "opened_bid": {
        "esg_score": 74,
        "lead_time_days": 14,
        "quality_score": 84,
        "unit_price": 9.1
      },
      "quantity": 900,
      "score": 0.816667,
      "status": "assigned",
      "supplier_id": "S17"
    },
    {
      "buyer_surplus": 8268.0,
      "cleared_unit_price": 62.1,
      "lot_id": "L10",
      "opened_bid": {
        "esg_score": 91,
        "lead_time_days": 18,
        "quality_score": 93,
        "unit_price": 62.1
      },
      "quantity": 520,
      "score": 0.813889,
      "status": "assigned",
      "supplier_id": "S18"
    }
  ],
  "auction_rule": "first-price-sealed",
  "commitments": [
    {
      "commitment_hash": "sha256:95a07bfed462c83e697a88fb60586ab72b02d07f2cfd7753bdf5eaa8b111369b",
      "supplier_id": "S01"
    },
    {
      "commitment_hash": "sha256:2a2d23e73bf7ac462bb02a33f7998a26630b795b0cdc3e6d00b694815eeb11e4",
      "supplier_id": "S02"
    },
    {
      "commitment_hash": "sha256:bbb9e86bb0f640ac4a86dc36891ac9307aa68d5b41fc5b10fff54eca43b829aa",
      "supplier_id": "S03"
    },
    {
      "commitment_hash": "sha256:58c705cc2bf8f634dfd1ce0c6e57438c71c49ee6e994bfb9345fe7672ebdd3a9",
      "supplier_id": "S04"
    },
    {
      "commitment_hash": "sha256:43166696fa769cf68475d20902545faca4c8b3123fe54f08f0e9b479eee1ed38",
      "supplier_id": "S05"
    },
    {
      "commitment_hash": "sha256:f22edce1ce399280e2a3f3f89b4c529fb249de3ecf6b7c46add531305bd35929",
      "supplier_id": "S06"
    },
    {
      "commitment_hash": "sha256:0fe246b1e8e58cae2112c82d47754ab21debe940d5f880109c2c0e026d5afc42",
      "supplier_id": "S07"
    },
    {
      "commitment_hash": "sha256:71f037cf9bc898ed2e5fd4398231874353e61a8d9358bdc0a37d2f55fefdf31a",
      "supplier_id": "S08"
    },
    {
      "commitment_hash": "sha256:7844e8dadc7e2e28ff47a22d3d0b4cfa800852866e483478694641580f1a9aa0",
      "supplier_id": "S09"
    },
    {
      "commitment_hash": "sha256:5f2230dc4c5f6d3e087f5e7b246f9e77d8a43e0f9a0f960ac6b66d5e148976ce",
      "supplier_id": "S10"
    },
    {
      "commitment_hash": "sha256:334290e093e80d1a4af85a11a4c16703300c64cb381d33df1e40f4803f994cb2",
      "supplier_id": "S11"
    },
    {
      "commitment_hash": "sha256:f4e579b7a824df31bf26c3e1102c5db10f6899e82cab6da068653d5e2518df15",
      "supplier_id": "S12"
    },
    {
      "commitment_hash": "sha256:e0936a7d316c2b941ea9f54a05a4e8947cef40527ebeb14f22f609e27b39209d",
      "supplier_id": "S13"
    },
    {
      "commitment_hash": "sha256:8c9739d670451bf16a6e33feca677d6b20152df5f3754cde6b5c51b638959bd0",
      "supplier_id": "S14"
    },
    {
      "commitment_hash": "sha256:5bc433bff30c8e17f03d427e28d2989a7ee466819c837ee2311ac03b50073575",
      "supplier_id": "S15"
    },
    {
      "commitment_hash": "sha256:b0033a706c4dcfdf03d2ea842bc17110bc7a967ab3df61a939be8048e07aa0cc",
      "supplier_id": "S16"
    },
    {
      "commitment_hash": "sha256:2b1d4728d281313a143601cc286ff23656e4929c8f2c3329a78020979c102c8e",
      "supplier_id": "S17"
    },
    {
      "commitment_hash": "sha256:c9b47e178881948689c119c9329b210847b9e18540bd9cc1d0093cedb4594b4d",
      "supplier_id": "S18"
    },
    {
      "commitment_hash": "sha256:03f079d6f3d382c262d224fee0ddee56fb9de51a11ff5e448fb9403a642eae5a",
      "supplier_id": "S19"
    },
    {
      "commitment_hash": "sha256:7781e27077abdd06f16c20d9561fa4c4ebc08515e1c76a3f55ed8291a68113d3",
      "supplier_id": "S20"
    }
  ],
  "generated_at": "2026-06-22T00:00:00Z",
  "leakage_profile": "winner ids, opened winning bids, per-lot scores, commitments, scenario hash",
  "receipt_id": "v1_20x10-sealed-v0.1.0",
  "runtime": "sealed",
  "runtime_version": "0.1.0",
  "scenario_hash": "sha256:d359aa6f1331a4bff7fe3629614619b2ff62e51c724be0366abd408583b6d42d",
  "scenario_id": "v1_20x10",
  "surplus": {
    "buyer": 54173.0
  }
}
